Name,Skills,Experience,Resume Summary,Preferred Roles,Cleaned_Resume,Extracted_Skills
Sanjay Iyer,"NLP, React, Django, CSS, Azure, Kubernetes",3 years,"Experienced professional skilled in NLP, React, Django, CSS, Azure, Kubernetes with 3 years of work.",Business Analyst,"experienced professional skilled in nlp, react, django, css, azure, kubernetes with 3 years of work.","['nlp', 'react', 'django', 'css', 'azure', 'kubernetes']"
Kiran Reddy,"Angular, AWS, HTML",9 years,"Experienced professional skilled in Angular, AWS, HTML with 9 years of work.",UI/UX Designer,"experienced professional skilled in angular, aws, html with 9 years of work.","['angular', 'aws', 'html']"
Kiran Singh,"JavaScript, Azure, Django",2 years,"Experienced professional skilled in JavaScript, Azure, Django with 2 years of work.",Software Tester,"experienced professional skilled in javascript, azure, django with 2 years of work.","['javascript', 'azure', 'django']"
Gopal Gupta,"Python, Django, Java, AWS, HTML, C++",10 years,"Experienced professional skilled in Python, Django, Java, AWS, HTML, C++ with 10 years of work.",Cloud Engineer,"experienced professional skilled in python, django, java, aws, html, c++ with 10 years of work.","['python', 'django', 'java', 'aws', 'html', 'c++']"
Deepa Gupta,"Docker, .NET, SQL, Cloud",6 years,"Experienced professional skilled in Docker, .NET, SQL, Cloud with 6 years of work.",Project Manager,"experienced professional skilled in docker, .net, sql, cloud with 6 years of work.","['docker', '.net', 'sql', 'cloud']"
Meera Gupta,"Flask, C++, .NET, Cybersecurity, CSS",5 years,"Experienced professional skilled in Flask, C++, .NET, Cybersecurity, CSS with 5 years of work.",Backend Developer,"experienced professional skilled in flask, c++, .net, cybersecurity, css with 5 years of work.","['flask', 'c++', '.net', 'cybersecurity', 'css']"
Swati Patel,"Kubernetes, C++, CSS, React, Flask, Django",9 years,"Experienced professional skilled in Kubernetes, C++, CSS, React, Flask, Django with 9 years of work.",Frontend Developer,"experienced professional skilled in kubernetes, c++, css, react, flask, django with 9 years of work.","['kubernetes', 'c++', 'css', 'react', 'flask', 'django']"
Geeta Sharma,"C++, .NET, DevOps, Spring",3 years,"Experienced professional skilled in C++, .NET, DevOps, Spring with 3 years of work.",Data Scientist,"experienced professional skilled in c++, .net, devops, spring with 3 years of work.","['c++', '.net', 'devops', 'spring']"
Mahesh Gupta,"Flask, Kubernetes, Java, Angular, Azure, C++",9 years,"Experienced professional skilled in Flask, Kubernetes, Java, Angular, Azure, C++ with 9 years of work.",Cloud Engineer,"experienced professional skilled in flask, kubernetes, java, angular, azure, c++ with 9 years of work.","['flask', 'kubernetes', 'java', 'angular', 'azure', 'c++']"
Sameer Khan,"Machine Learning, Cloud, Testing, Azure",5 years,"Experienced professional skilled in Machine Learning, Cloud, Testing, Azure with 5 years of work.",Backend Developer,"experienced professional skilled in machine learning, cloud, testing, azure with 5 years of work.","['machine learning', 'cloud', 'testing', 'azure']"
Varun Patel,"Flask, Spring, CSS, Angular",9 years,"Experienced professional skilled in Flask, Spring, CSS, Angular with 9 years of work.",Software Tester,"experienced professional skilled in flask, spring, css, angular with 9 years of work.","['flask', 'spring', 'css', 'angular']"
Varun Gupta,"React, DevOps, JavaScript",10 years,"Experienced professional skilled in React, DevOps, JavaScript with 10 years of work.",Cloud Engineer,"experienced professional skilled in react, devops, javascript with 10 years of work.","['react', 'devops', 'javascript']"
Gopal Gupta,"Node.js, .NET, Machine Learning, Django, Spring",9 years,"Experienced professional skilled in Node.js, .NET, Machine Learning, Django, Spring with 9 years of work.",Frontend Developer,"experienced professional skilled in node.js, .net, machine learning, django, spring with 9 years of work.","['node.js', '.net', 'machine learning', 'django', 'spring']"
Rajesh Sharma,"HTML, NLP, Cloud, Cybersecurity",2 years,"Experienced professional skilled in HTML, NLP, Cloud, Cybersecurity with 2 years of work.",DevOps Engineer,"experienced professional skilled in html, nlp, cloud, cybersecurity with 2 years of work.","['html', 'nlp', 'cloud', 'cybersecurity']"
Aditya Mehta,"Django, .NET, Testing, Automation",6 years,"Experienced professional skilled in Django, .NET, Testing, Automation with 6 years of work.",Project Manager,"experienced professional skilled in django, .net, testing, automation with 6 years of work.","['django', '.net', 'testing', 'automation']"
Deepa Nair,"Java, AWS, React, Node.js, HTML, Cybersecurity",3 years,"Experienced professional skilled in Java, AWS, React, Node.js, HTML, Cybersecurity with 3 years of work.",Backend Developer,"experienced professional skilled in java, aws, react, node.js, html, cybersecurity with 3 years of work.","['java', 'aws', 'react', 'node.js', 'html', 'cybersecurity']"
Swati Singh,"Automation, .NET, Flask",9 years,"Experienced professional skilled in Automation, .NET, Flask with 9 years of work.",Full Stack Engineer,"experienced professional skilled in automation, .net, flask with 9 years of work.","['automation', '.net', 'flask']"
Varun Das,"Python, DevOps, Docker, JavaScript, AWS, Machine Learning",11 years,"Experienced professional skilled in Python, DevOps, Docker, JavaScript, AWS, Machine Learning with 11 years of work.",DevOps Engineer,"experienced professional skilled in python, devops, docker, javascript, aws, machine learning with 11 years of work.","['python', 'devops', 'docker', 'javascript', 'aws', 'machine learning']"
Suresh Mehta,"Cybersecurity, Flask, AWS",8 years,"Experienced professional skilled in Cybersecurity, Flask, AWS with 8 years of work.",ML Engineer,"experienced professional skilled in cybersecurity, flask, aws with 8 years of work.","['cybersecurity', 'flask', 'aws']"
